[
 {
  "provenance": {
   "fixture": "test/fixtures/repair_verification/tools/shift_candidates.json (from t6_tool_sources.jl#shift)",
   "note": "checkpoint_id 't0' is the constant id every parent writes (T7 report 9-2)",
   "source": "fixture"
  },
  "tool_name": "t10b_shift_build_1!",
  "impl_name": "t10b_shift_build_1!",
  "submission_index": 1,
  "impl_code": "function t10b_shift_build_1!(env; dx::Float64 = 1.0, dy::Float64 = 0.0)\n    T = CoordinateTransformations.Translation(dx, dy, 0.0)\n    ts = Any[]\n    for aid in sort!(collect(keys(env.staging_circles)); by = string)\n        push!(ts, start_config(get_node(env.sched, AssemblyComplete(get_node(env.scene_tree, aid)))))\n    end\n    top(t) = (c = t; while !has_parent(c, c); c = get_parent(c); any(x -> x === c, ts) && return false; end; true)\n    for t in ts\n        top(t) && set_desired_global_transform!(t, T \u2218 global_transform(t))\n    end\n    for aid in collect(keys(env.staging_circles))\n        b = env.staging_circles[aid]\n        env.staging_circles[aid] = LazySets.Ball2(Vector{Float64}(get_center(b)[1:2]) .+ [dx, dy], Float64(get_radius(b)))\n    end\n    return :shifted\nend",
  "checkpoint_id": "t0",
  "specification": {
   "mechanism": "T10b hand-written validator fixture (not model output): rigid whole-build translation by (1.0, 0.0) \u2014 assembly start configs + staging circles; scene resync is left to the harness"
  },
  "params": {},
  "calls": [
   {
    "args": {},
    "primitive": "t10b_shift_build_1!"
   }
  ],
  "proposal_id": "t10b-shift1m-1",
  "schema_version": "tool-proposal/1"
 },
 {
  "provenance": {
   "fixture": "test/fixtures/repair_verification/tools/shift_candidates.json (from t6_tool_sources.jl#shift)",
   "note": "checkpoint_id 't0' is the constant id every parent writes (T7 report 9-2)",
   "source": "fixture"
  },
  "tool_name": "t10b_shift_build_2!",
  "impl_name": "t10b_shift_build_2!",
  "submission_index": 2,
  "impl_code": "function t10b_shift_build_2!(env; dx::Float64 = 0.0, dy::Float64 = 1.0)\n    T = CoordinateTransformations.Translation(dx, dy, 0.0)\n    ts = Any[]\n    for aid in sort!(collect(keys(env.staging_circles)); by = string)\n        push!(ts, start_config(get_node(env.sched, AssemblyComplete(get_node(env.scene_tree, aid)))))\n    end\n    top(t) = (c = t; while !has_parent(c, c); c = get_parent(c); any(x -> x === c, ts) && return false; end; true)\n    for t in ts\n        top(t) && set_desired_global_transform!(t, T \u2218 global_transform(t))\n    end\n    for aid in collect(keys(env.staging_circles))\n        b = env.staging_circles[aid]\n        env.staging_circles[aid] = LazySets.Ball2(Vector{Float64}(get_center(b)[1:2]) .+ [dx, dy], Float64(get_radius(b)))\n    end\n    return :shifted\nend",
  "checkpoint_id": "t0",
  "specification": {
   "mechanism": "T10b hand-written validator fixture (not model output): rigid whole-build translation by (0.0, 1.0) \u2014 assembly start configs + staging circles; scene resync is left to the harness"
  },
  "params": {},
  "calls": [
   {
    "args": {},
    "primitive": "t10b_shift_build_2!"
   }
  ],
  "proposal_id": "t10b-shift1m-2",
  "schema_version": "tool-proposal/1"
 },
 {
  "provenance": {
   "fixture": "test/fixtures/repair_verification/tools/shift_candidates.json (from t6_tool_sources.jl#shift)",
   "note": "checkpoint_id 't0' is the constant id every parent writes (T7 report 9-2)",
   "source": "fixture"
  },
  "tool_name": "t10b_shift_build_3!",
  "impl_name": "t10b_shift_build_3!",
  "submission_index": 3,
  "impl_code": "function t10b_shift_build_3!(env; dx::Float64 = -1.0, dy::Float64 = 0.0)\n    T = CoordinateTransformations.Translation(dx, dy, 0.0)\n    ts = Any[]\n    for aid in sort!(collect(keys(env.staging_circles)); by = string)\n        push!(ts, start_config(get_node(env.sched, AssemblyComplete(get_node(env.scene_tree, aid)))))\n    end\n    top(t) = (c = t; while !has_parent(c, c); c = get_parent(c); any(x -> x === c, ts) && return false; end; true)\n    for t in ts\n        top(t) && set_desired_global_transform!(t, T \u2218 global_transform(t))\n    end\n    for aid in collect(keys(env.staging_circles))\n        b = env.staging_circles[aid]\n        env.staging_circles[aid] = LazySets.Ball2(Vector{Float64}(get_center(b)[1:2]) .+ [dx, dy], Float64(get_radius(b)))\n    end\n    return :shifted\nend",
  "checkpoint_id": "t0",
  "specification": {
   "mechanism": "T10b hand-written validator fixture (not model output): rigid whole-build translation by (-1.0, 0.0) \u2014 assembly start configs + staging circles; scene resync is left to the harness"
  },
  "params": {},
  "calls": [
   {
    "args": {},
    "primitive": "t10b_shift_build_3!"
   }
  ],
  "proposal_id": "t10b-shift1m-3",
  "schema_version": "tool-proposal/1"
 },
 {
  "provenance": {
   "fixture": "test/fixtures/repair_verification/tools/shift_candidates.json (from t6_tool_sources.jl#shift)",
   "note": "checkpoint_id 't0' is the constant id every parent writes (T7 report 9-2)",
   "source": "fixture"
  },
  "tool_name": "t10b_shift_build_4!",
  "impl_name": "t10b_shift_build_4!",
  "submission_index": 4,
  "impl_code": "function t10b_shift_build_4!(env; dx::Float64 = 0.0, dy::Float64 = -1.0)\n    T = CoordinateTransformations.Translation(dx, dy, 0.0)\n    ts = Any[]\n    for aid in sort!(collect(keys(env.staging_circles)); by = string)\n        push!(ts, start_config(get_node(env.sched, AssemblyComplete(get_node(env.scene_tree, aid)))))\n    end\n    top(t) = (c = t; while !has_parent(c, c); c = get_parent(c); any(x -> x === c, ts) && return false; end; true)\n    for t in ts\n        top(t) && set_desired_global_transform!(t, T \u2218 global_transform(t))\n    end\n    for aid in collect(keys(env.staging_circles))\n        b = env.staging_circles[aid]\n        env.staging_circles[aid] = LazySets.Ball2(Vector{Float64}(get_center(b)[1:2]) .+ [dx, dy], Float64(get_radius(b)))\n    end\n    return :shifted\nend",
  "checkpoint_id": "t0",
  "specification": {
   "mechanism": "T10b hand-written validator fixture (not model output): rigid whole-build translation by (0.0, -1.0) \u2014 assembly start configs + staging circles; scene resync is left to the harness"
  },
  "params": {},
  "calls": [
   {
    "args": {},
    "primitive": "t10b_shift_build_4!"
   }
  ],
  "proposal_id": "t10b-shift1m-4",
  "schema_version": "tool-proposal/1"
 }
]